ID,Tiếng Việt,Tiếng BaNa
202,"Có trách nhiệm thông báo chủ trương tổ chức Liên hoan Quốc tế Võ cổ truyền Việt Nam lần thứ VII năm 2019 đến các xã, phường, thị trấn;","ÔÊi tôdrong pôtho khan tôdrong pôloêk Lieân hoan KuoâÊc teâÊ Vo coâ trueân Vieât Nam maêng maê tôpôêh sônaêm ‘baêl ôbôêu khoâng hrieâng minh jiêt tôxiênh truh rim xa, phöông, thi traân"
203,"Đồng thời chỉ đạo các ngành chức năng có kế hoạch tuyên truyền, bảo vệ an ninh trật tự, an toàn trong thời gian các đoàn đến giao lưu","Thoi ‘noh pôgôl rim nganh chöêk naêng ôêi glong pônhroh pôtho khan, jö veêi an ninh traât tö, an toan lôm jônang rim ñoan truh giao löu"
204,"Biểu diễn, tham quan tại các lò võ tiêu biểu, di tích lịch sử, văn hóa, các điểm du lịch nổi tiếng trên địa bàn.","‘Bieâu dieân, tham kuan dônoê rim lo vo pôgloh, di tich lich sö, vaên hoa, rim dônoê yu lich pôgloh lôêm tôring"
205,"Chỉ đạo Phòng Văn hóa và Thông tin, Trung tâm Văn hóa Thông tin và Thể thao phối hợp với Ban tổ chức trong công tác tổ chức các chương trình trong Liên hoan ","Pôgôl Phong Vaên hoa oeêng Thoâng tin, Trung taâm Vaên hoa Thoâng tin oeêng Theâ thao adriêng Khul pôloêk lôêm tôdrong pôloêk rim tôdrong lôêm Lieân hoan"
206,"(Lễ Dâng hoa, Dâng hương, chương trình giao lưu, biểu diễn kết hợp tham quan du lịch tại các lò võ tiêu biểu...) trên địa bàn.","(Maêng ‘yaâng pôkao, ‘yaâng höông, chöông trinh giao löu, ‘bieâu dieân adriêng tham kuan yu lich dônoê rim lo pjo pôgloh…) lôêm tôring"
207,UBND thành phố Quy Nhơn:,UBND thanh phoâ Quy Nhôn
208,Phối hợp với Sở Văn hóa và Thể thao trong công tác tuyên truyền trực quan trên địa bàn thành phố Quy Nhơn;,Adriêng Sô Vaên hoa oeêng Theâ thao lôêm tôdrong pôtho khan tröêk kuan lôêm tôring thanh phoâ Quy Nhôn
209,"Triển khai kế hoạch đảm bảo vệ sinh môi trường, cảnh quan đường phố sạch đẹp trong thời gian diễn ra Liên hoan;","Pônhroh glong pônhroh tômaên tôl veâ sinh moâi tröông, kanh kuan trong phoâÊ uoâil ieâÊl alöng lieâm lôêm jônang pôloêk Lieân hoan"
210,Huy động nhân dân đến xem các chương trình trong Liên hoan.,Krao kon tôring truh ngoê rim tôdrong lôêm Lieân hoan
211,"Chỉ đạo các đơn vị liên quan chủ động bố trí nơi đấu nối nguồn điện, máy phát điện dự phòng để Ban tổ chức Liên hoan lắp ráp cơ sở vật chất, trang thiết bị phục vụ tổ chức tại Quảng trường Nguyễn Tất Thành. ","Pôgôl rim ñôn viê lieân kuan chu ñoâng ‘boâÊ triê dônoê pôteêp nguoân ñieân, maêy phat ñieân yöê phong söê Khul pôloêk Lieân hoan laêp rap ñoâ tôguêm pôloêk dônoê Kuang tröông Nguyeân Taât Thanh"
212,"Bố trí địa điểm làm bãi đậu xe cho Ban tổ chức, đại biểu, khán giả và các đơn vị thực hiện tổ chức.","‘BoâÊ triê dônoê pôm dônoê söê xe aên Khul pôloêk, ñai ‘bieâu, naê ma oeêng rim ñôn viê pôm tôdrong pôloêk"
213,Giao Giám đốc Sở Văn hóa và Thể thao chịu trách nhiệm giúp Chủ tịch UBND tỉnh,Pôjao Giam ñoâc Sô Vaên hoa oeêng Theâ thao chiêu trach nhieâm tôguêm Chu tich UBND tinh
214,"Tỉnh theo dõi, đôn đốc, kiểm tra và báo cáo Chủ tịch UBND tỉnh tình hình triển khai thực hiện kế hoạch này.","Tinh ngoê hnheêi, pôtho khan, ngoê hnheêi oeng pôtho khan Chu tich UBND tinh tôdrong pônhroh pôm glong pônhroh anu"
215,"Yêu cầu các cơ quan, đơn vị được phân công nêu trên xây dựng kế hoạch, phối hợp triển khai thực hiện.","Pôkaê rim kô kuan, ñôn viê ñeêi phaân koâng khan ‘noh tôjung pôm glong pônhroh, adriêng pônhroh pôm"