ID,Tiếng Việt,Tiếng BaNa
0054,Huyện Vĩnh Thạnh hiện có 1 Trung tâm Giáo dục Nghề nghiệp - Giáo dục Thường xuyên tham gia đào tạo nghề cho lao động nông thôn trình độ dưới 3 tháng và sơ cấp với các nghề nông nghiệp và nghề phi nông nghiệp,Huyeân Vinh Thanh ahreêi ôêi 01 TT GDNN – GDTX pôtôêp ngheâ aên naê ma cham pôlei trinh ñoâ ñim ñei 3 kheêi oeêng sô caâp adriêng rim ngheâ noâng nghieâp oeêng phi noâng nghieâp
0055,"Các nghề nông nghiệp chủ yếu là kỹ thuật chăn nuôi, phòng trị bệnh cho trâu, bò, lợn, gia cầm, thủy cầm; kỹ thuật trồng quản lý dịch hại trên cây trồng; kỹ thuật trồng thâm canh cây ăn quả, cây nguyên liệu giấy","Rim nngheâ noâng nghieâp pôgloh la kô kach kiêa rong, phong dôt jiê aên kapoâ, lômo, nhuêng, ‘yeêr, ôda; kô kach pôtaêm oeêng ngoê hnhei jôroâng pôm glaêi ‘long pôtaêm; kô kach pôtaêm thaâm kanh ‘long sa pleêi, ‘long nguyeân lieâu"
0056,"Những năm qua, tập trung vào công tác đào tạo nghề cho lao động nông thôn, Trung tâm Giáo dục Nghề nghiệp - Giáo dục Thường xuyên không ngừng tăng cường cơ sở vật chất, trang thiết bị, đẩy mạnh việc đào tạo, bồi dưỡng giáo viên, cán bộ quản lý dạy nghề","Lö sônaêm anu yuoâ ôêu, pônhoâm tômöt tôdrong pôtôêp ngheâ aên naê ma cham pôlei, TT GDNN- GDTX biê thoâi kjung cô sô vaât chaât, trang thieât bi, jôraê deâh tôdrong ñao tao, tôguêm bôngai pôtôêp pôtho, kang boâ ngoê hnhei pôtôêp ngheâ"
0057,"Cùng với đó, danh mục nghề đào tạo được bổ sung phù hợp theo nhu cầu của thị trường lao động và yêu cầu phát triển kinh tế - xã hội của địa phương","Adriêng ‘noh, danh muc ngheâ ñao tao ñei tôguêm trô troê ‘boi tôdrong waê ñôêng thi tröông oeêng tôdrong pôjing kinh teâ xa hoâi ñôêng cham pôlei"
0058,"Chị Đinh Thị Bôi, người dân tộc Bana ở làng K3, xã Vĩnh Sơn, cho biết: “Năm 2017, tôi được tham gia lớp nghề nông nghiệp được mở tại xã Vĩnh Sơ","Mai Ñinh Thi Boâi, la bôngai kon koâng oei pôlei K3, xa Vinh Sôn aên aleÊâ: “Sônaêm 2017, inh ñei naêm hoêk lôêp ngheâ noâng nghieâp ñei pôloêk lôêm xa Vinh Sôn"
0059,"Chúng tôi vừa được học lý thuyết, vừa được thực hành trên mô hình trồng rau an toàn theo Dự án rau an toàn do Đại sứ quán New Dilan triển khai tại địa phương",Nhôên böa ñei hoêk ly thuyeât böa ñei pôm lôêm moâ hinh pôtaêm hla nheêm an toan ‘boi Dö an hla nhem an toan yua Ñai sö quan New Zilan pônhroh lôêm tôring
0060,Vì vừa học vừa được ứng dụng thực tế nên chúng tôi dễ dàng nắm bắt được những kiến thức cơ bản về trồng rau an toàn,Yua böa hoêk böa ñei pôm tôpaê kôna nhôn hlaêu roâp baêt ñei rim tôdrong baêt kô ban lôêm pôtaêm hla nheêm an toan
0061,Đến nay bà con chúng tôi đã tự mình làm được rồi,Truh ahreêi nhôên jôh kôdih pôm ñei
0062,"Dạy nghề cho lao động nông thôn, nhất là lao động miền núi là một chính sách lớn của Đảng và Nhà nước nhằm giúp người dân có điều kiện xóa đói giảm nghèo, nỗ lực thóat nghèo bằng chính sức lao động của mình","Pôtôêp ngheâ aên naê ma cham pôlei, pôgloh la naê ma apung koâng la minh tôdrong pôgloh ñôêng Ñang oeêng kôpal söê tôguêm aên naê ma ôêi tôdrong tuêk bôngot dônuh, pran ñiê dônuh ñôêng chiênh tôdrong pôm ñôêng ôkôêu"
0063,"Tuy nhiên, để công tác dạy nghề phát huy hiệu quả hơn nữa, nhà nước cần có chính sách đầu tư cho công tác dạy nghề đối với đồng bào vùng sâu, vùng xa nhiều hơn nữa","Maêleêi, söê tôdrong pôtôêp ngheâ ôêi thu yoêk loi pieâu, kôpal waê ôêi tôdrong tôguêm aên tôdrong pôtôêp ngheâ adriêng naê ma apung koâng, apung hloê lö loi pieâu"
0064,"Đặc biệt, cần nâng cao chất lượng dạy nghề gắn với giải quyết việc làm","Pôgloh, waê poâk xuoân tôdrong thu yoêk ñei pôtôêp ngheâ pôteêp adriêng tôguêm tôdrong pôm"
0065,"Có như vậy, bà con mới tin và thực sự coi việc học nghề là một hướng để thoát nghèo",ÔÊi in ‘noh naê ma anao lui oeêng tôpaê ngoê tôdrong hoêk ngheâ la minh tôdrong söê ñiê dônuh