ID,Tiếng Việt,Tiếng BaNa
0001,"Sáng ngày 4.3, Đảng ủy xã Vĩnh Quang tổ chức hội nghị quán triệt học tập nội dung chuyên đề năm 2020 cho toàn thể đảng viên trong Đảng bộ","Bôgheâ ‘naêr 04.3, Ñang uy xa Vinh Quang pôloêk Hoâi nghi quan trieât hoêk tôêp tôdrong chuyeân ñeâ sônaêm 2020 aên ñiê ñaêng Ñang vieân lôêm Ñang boâ"
0002,"Tham gia học tập, đảng viên đã được triển khai quán triệt chuyên đề tăng cường khối đại đoàn kết toàn dân tộc, xây dựng Đảng và hệ thống chính trị trong sạch, vững mạnh theo tư tưởng, đạo đức, phong cách Hồ Chí Minh","Adriêng pôm hoêk tôêp, ñang vieân jôh ñei pônhroh quan trieât chuyeân ñeâ kjung khoâi ñai ñoan keât ñiê ñaêng naê ma, tôjung pôm Ñang oeêng tôdrong chinh tri uoâi ieâl, kôjaêp ‘boi nöih sôngöm yaêl arih alöng lieâm HCM"
0003,"Những nội dung cụ thể về tư tưởng, đạo đức, phong cách Hồ Chí Minh; bài học lịch sử của cách mạng Việt Nam dưới sự lãnh đạo của Đảng về đại đoàn kết toàn dân tộc, xây dựng Đảng và hệ thống chính trị trong sạch, vững mạnh; những vấn đề đặt ra về đại đoàn kết toàn dân tộc, xây dựng Đảng và hệ thống chính trị trong sạch, vững mạnh trong tình hình hiện nay; vận dụng tư tưởng Hồ Chí Minh về đại đoàn kết toàn dân tộc là đường lối chiến lược của cách mạng Việt Nam, là động lực, nguồn lực to lớn trong xây dựng và bảo vệ Tổ quốc; xây dựng Đảng và hệ thống chính trị trong sạch, vững mạnh, phát huy sức mạnh khối đại đoàn kết toàn dân tộc; tiếp tục hoàn thiện, cụ thể hóa, thể chế hóa các quan điểm, chủ trương của Đảng, chính sách, pháp luật của Nhà nước; một số nhiệm vụ, giải pháp cụ thể","Rim tôdrong cu theâ lôêm nöih sôngöm yaêl arih alöng lieâm HCM; ‘bai hoêk lich sö ñôêng kach mang Vieât Nam ôla tôdrong pôgôl ñôêng Ñang lôêm ñai ñoan keât ñiê ñaêng naê ma; tôjung pôm Ñang oeêng tôdrong chinh tri uoâil ieâl kôjaêp; rim tôdrong aên leêch lôêm ñai ñoan keât ñiê ñaêng naê ma, tôjung pôm Ñang oeêng tôdrong chinh tri uoâil ieâl kôjaêp lôêm tôdrong ahreêi; chaê yuoâ nöih sôngöm HCM lôêm ñai ñoan keât ñiê ñaêng naê ma la tôdrong chieân löôc ñôêng kach mang Vieât nam, la tôdrong groâng lôêm tôjung pôm oeêng jö vei teh ñak; tôjung pôm Ñang oeêng tôdrong chinh tri uoâil ieâl kôjaêp, phat huy rim tôdrong ñôêng Ñang, chiênh sach phap luaât ñôêng kôpal; minh ksoâ Êtôdrong pôm cu theâ"
0004,"Sau khi học tập chuyên đề này, Đảng ủy xã đề nghị các chi bộ cần đưa nội dung sinh hoạt chuyên đề năm 2020 vào sinh hoạt thường kỳ và sinh hoạt chuyên đề, ít nhất mỗi quý một lần, định kỳ tổ chức sinh hoạt về những nội dung có liên quan trực tiếp tới nhiệm vụ chính trị của chi bộ và các đảng viên của chi bộ, thảo luận, trao đổi về các giải pháp khắc phục những hạn chế, đề ra phương hướng phấn đấu, đánh giá kết quả làm theo, báo cáo kết quả với cấp ủy cấp trên","Ñôêng roêng hoêk tôêp chuyeân ñeâ anu, Ñang uy xa pôkaê rim chi boâ waê aên tôdrong sinh hoat chuyeân ñeâ sônaêm 2020 tômöt sinh hoat thöông ky oeêng sinh hoat chuyeân ñeâ, ‘biêa pôgloh minh quyê minh maêng, ñinh ky pôloêk sinh hoat lôêm rim tôdrong ôêi lieân quan trök tieâp truh tôdrong chinh tri ñôêng chi boâ oeêng rim ñang vieân ñôêng chi boâ, pôñam ‘bôl lôêm rim tôdrong khaêk phuêk rim han cheâÊ, aên leêch tôdrong pran, pôtho khan thu yoêk pôm ‘boi, pôtho khan thu yoêk adriêng kôêp uy kôêp kôpöng"
0005,"Từng đảng viên liên hệ bản thân tiến hành xây dựng bản cam kết tu dưỡng, rèn luyện, phấn đấu của cá nhân, đồng thời đề ra phương hướng phấn đấu làm theo, khắc phục những hạn chế, khuyết điểm của mình trong quá trình công tác, sinh hoạt hằng ngày","Rim ñang vieân lieân heâ kôdih ôkôêu naêm truh tôjung pôm hla cam keât tu döông, ren luyeân, pran ñôêng kôdih ôkôêu, thoi ‘noh aên leêch tôdrong pran pôm ‘boi, khaêc phuêk rim han cheâÊ, khuyeât ñieâm ñôêng ôkôêu lôêm jônang pôm, sinh hoat rim ‘naêr"