ID,Tiếng Việt,Tiếng BaNa
0001,"Thực hiện chính sách hỗ trợ phụ nữ thuộc hộ nghèo là người dân tộc thiểu số, sinh con đúng chính sách dân số theo Nghị định số 39 của Chính phủ.","Pôm tôdrong tôgum mai oh oei lôm kôbraê unh hnam dônuh la mai oh kon koâng, ñeh kon tro tôdrong daân soâ boi Nghi ñinh ksoâ 39 ñông Chinh phu."
0002,"Theo đó, từ năm 2015 đến 2018, huyện Vĩnh Thạnh đã lập thủ tục giải quyết cho 307 phụ nữ thuộc hộ nghèo đồng bào DTTS, được hưởng chính sách hỗ trợ với tổng số tiền 614 triệu đồng.","Boi noh, ñông sônaêm 2015 truh sônaêm 2018, huyeân Vinh Thanh jôh pôm thu tuc tôgum aên 307 mai oh oei lôm kôbraê unh hnam dônuh naê ma kon koâng ñei höông tôdrong tôgum adring pôting ksoâ jeân 614 trieâu ñoâng."
0003,Riêng trong năm 2018 có 71 người với số tiền hỗ trợ 142 triệu đồng. Định mức hỗ trợ 2 triệu đồng/người.,Riêng trong năm 2018 có 71 người với số tiền hỗ trợ 142 triệu đồng. Định mức hỗ trợ 2 triệu đồng/người.
0004,"Nghị định 39 của Chính phủ ban hành, thể hiện sự quan tâm của Đảng, Nhà nước đối với phụ nữ thuộc hộ nghèo là người dân tộc thiểu số, khi sinh con đúng chính sách dân số.","Nghị định 39 của Chính phủ ban hành, thể hiện sự quan tâm của Đảng, Nhà nước đối với phụ nữ thuộc hộ nghèo là người dân tộc thiểu số, khi sinh con đúng chính sách dân số."
0005,"Đây là chính sách cần thiết nhằm ổn định tình hình dân số, kế hoạch hóa gia đình và bảo vệ quyền lợi cho phụ nữ tại vùng đồng bào dân tộc thiểu số.","Anu la tôdrong kô waê sö alöng tôdrong daân soâ, keâ hoach hoa unh hnam oeng jö vei quyeân lôi aên mai o lôm apung naê ma kon koâng."
0006,"Sáng ngày 9.10, Huyện ủy Vĩnh Thạnh tổ chức Hội nghị BCH đảng bộ huyện lần thứ 18 nhằm đánh giá tình hình thực hiện nhiệm vụ 9 tháng đầu năm và triển khai nhiệm vụ 3 tháng còn lại năm 2019","Bôgheâ naêr 09/10, Huyeân uy Vinh Thanh pôlok Hoâi nghi Ban chaâp hanh Ñang boâ huyeân maêng maê 18 sö pôtho khan tôdrong pôm nhieâm vu 9 khei kôl sônaêm oeng pônhroh tôdrong pôm 3 khei araê sônaêm 2019"
0007,"Trong 9 tháng đầu năm, tổng giá trị sản xuất tăng 14 % so với cùng kỳ, giá trị sản xuất nông, lâm, thủy sản ước đạt 74,5% kế hoạch, tăng 22% so với cùng kỳ","Lôm 9 khei kôl sônaêm, pôting giaê tri choh jang kjung 14% pôting adring kung ky, giaê tri choh jang noâng, laâm, thuy san öôk ñat 74,5% glong pônhroh, kjung 22% pôting adring kung ky"
0008,Các lĩnh vực văn hoá - xã hội có nhiều chuyển biến tích cực,Rim tôdrong vaên hoa – xa hoâi ôi lö tôplih pôjaêng
0009,An ninh chính trị và trật tự an toàn xã hội được đảm bảo,An ninh chinh tri oeng traât tö an toan xa hoâi ñei tômaên tôl
0010,"Công tác xây dựng Đảng và củng cố hệ thống chính trị từ huyện đến cơ sở, đạt được nhiều kết quả khả quan",Tôdrong tôjung pôm Ñang oeng cung coâ tôdrong chinh tri ñông huyeân truh cô sô ñat ñei lö thu yok
0011,"Năng lực lãnh đạo của Đảng, hiệu lực, hiệu quả hoạt động quản lý, điều hành của cấp ủy, chính quyền từng bước được nâng lên","Tôdrong pôgôl ñông Ñang, thu yok tôdrong ngo hnhei, pôgôl ñông kôp uy, khul pôgôl rim tôdrong ñei poâk xuoân"
0012,"Tại hội nghị, các đại biểu đã dành thời gian phân tích và chỉ rõ những hạn chế yếu kém cần khắc phục trong thời gian tới, để thực hiện hoàn thành chỉ tiêu nhiệm vụ đề ra trong 3 tháng cuối năm 2019","Dôno hoâi nghi, rim naê ma pôgôl jôh sö jônang pôñam bôl oeng chi maê ro rim tôdrong han cheâ waê kaêc phuk lôm jônang truh sö pôm keh kong rim tôdrong aên lech lôm 03 khei atuch sônaêm 2019"
0013,"Theo đó, BCH Đảng bộ huyện tiếp tục phát huy nội lực, quan tâm chỉ đạo phát triển kinh tế, đầu tư phát triển sản xuất, xây dựng cơ bản, đảm bảo an sinh xã hội, đảm bảo ổn định chính trị, phòng chống có hiệu quả các loại tội phạm và tệ nạn xã hội","Boi noh, khul chaâp hanh Ñang boâ huyeân ling lang pôjing noâi lök, ngo hnhei pôgôl pôjing kinh teâ, tôgum pôjing choh jang, tôjung pôm kô ban, tômaên tôl an sinh xa hoâi, tômaên tôl alöng chinh tri, phong dôt ôi thu yok rim loai bôngai pôm glaêi oeng teâ nan xa hoâi"
0014,"Chú trọng công tác phát triển đảng viên, tiếp tục thực hiện Nghị quyết số 18 của BCH TƯ Đảng Khóa XII về sắp xếp bộ máy tinh gọn, hoạt động hiệu quả, đẩy mạnh củng cố xây dựng tổ chức cơ sở Đảng trong sạch vững mạnh, nâng cao năng lực lãnh đạo và sức chiến đấu của tổ chức cơ sở Đảng","Ngo hnhei tôdrong pôjing ñang vieân, ling lang pôm Nghi quyeât ksoâ 18 ñông Khul chaâp hanh TÖ Ñang khoa XIII lôm sap xeâp boâ may alöng, pôm ôi thu yok, jôraê deâh cung coâ tôjung pôm toâ chöc cô sô Ñang uoâl ieâl kôjaêp, poâk xuoân tôdrong pôgôl oeng jaêng tôplah ñông toâ chöc cô sô Ñang"
0015,"Triển khai có hiệu quả nội dung học tập và làm theo tư tưởng, đạo đức, phong cách Hồ Chí Minh về nêu cao tinh thần trách nhiệm chống chủ nghĩa cá nhân gắn với thực hiện các chỉ thị, nghị quyết của Trung ương về xây dựng Đảng","Pônhroh ôi thu yok tôdrong hok tôp oeng pôm boi nöih sôngöm yaêl arih alöng lieâm HCM lôm poâk xuoân nöih sôngöm trach nhieâm dôt chu nghia kôdih ôkôu pôtep adring pôm rim chi thi, nghi quyeât ñông Trung öông lôm tôjung pôm Ñang"
0016,"Dịp này, Huyện ủy Vĩnh Thạnh cũng đã dành thời gian triển khai nội dung Chỉ thị 35 ngày 30.5.2019 của Bộ Chính trị và Kế hoạch thực hiện Chỉ thị 35 của Huyện ủy Vĩnh Thạnh về đại hội đảng bộ các cấp tiến tới Đại hội đại biểu toàn quốc lần thứ XIII của Đảng","Maêng maê anu, Huyeân uy Vinh Thanh kung jôh sö jônang pônhroh noâi dung chi thi 35 naêr 30/5/2019 ñông Boâ chinh tri oeng glong pônhroh pôm chi thi 35 ñông Huyeân uy Vinh Thanh lôm Ñai hoâi Ñang boâ rim kôp naêm truh Ñai hoâi Ñai bieâu toan quoâc maêng maê XIII ñông Ñang"
0017,"Phát biểu kết luận hội nghị, đồng chí Hồ Xuân Ánh - Tỉnh ủy viên, Bí thư Huyện ủy nhấn mạnh những kết quả đạt được và hạn chế trong công tác lãnh đạo, chỉ đạo tổ chức thực hiện nhiệm vụ chính trị 9 tháng đầu năm, đồng thời chỉ ra một số nhiệm vụ công tác trọng tâm của 3 tháng cuối năm 2019","Pôñam bôl atuch Hoâi nghi, ñ/c Hoâ Xuaân Anh – Tinh uy vieân, Bi thö Huyeân uy pôñam deâh rim thu yok ñat ñei oeng tôdrong han cheâ lôm tôdrong pôgôl pôlok pôm tôdrong chinh tri 9 khei kôl sônaêm, thoi noh pôchi lech minh ksoâ tôdrong pôm pôgloh ñông 3 khei atuch sônaêm 2019"
0018,"Giao nhiệm vụ cho các tổ chức cơ sở Đảng tập trung lãnh đạo thực hiện thắng lợi các nhiệm vụ kinh tế - xã hội, định hướng tư tưởng đảm bảo sự ổn định, thống nhất trong Đảng và sự đồng thuận trong nhân dân","Pôjao tôdrong pôm aên rim toâ chöc cô sô Ñang pônhoâm pôgôl pôm thaêng lôi rim tôdrong kinh teâ xa hoâi, ñinh höông nöih sôngöm tômaên tôl tôdrong alöng lôm Ñang oeng tôdrong kô waê ñông kon tôring"
0019,"Đẩy mạnh củng cố xây dựng tổ chức cơ sở Đảng trong sạch vững mạnh, nâng cao năng lực lãnh đạo và sức chiến đấu của tổ chức cơ sở Đảng","Jôraê deâh cung coâ tôjung pôm toâ chöc cô sô Ñang uoâl ieâl kôjaêp, poâk xuoân tôdrong pôgôl oeng jaêng tôplah ñông toâ chöc cô sô Ñang"
0020,"Về công tác chuẩn bị Đại hội Đảng bộ các cấp tiến tới Đại hội XIII của Đảng, đồng chí Bí thư Huyện ủy đề nghị các đại biểu cần tiếp thu nghiêm túc và triển khai thực hiện tốt Chỉ thị số 35 ngày 30/5/2019 của Bộ Chính trị về Đại hội Đảng bộ các cấp tiến tới Đại hội Đại biểu toàn quốc lần thứ XIII của Đảng","Lôm tôdrong goâ ñech Ñai hoâi Ñang boâ rim kôp naêm truh Ñai hoâi XIII ñông Ñang, ñ/c Bi thö huyeân uy pôkaê rim naê ma pôgôl waê tieâp thu tôpaê oeng pônhroh pôm hôgei chi thi ksoâ 35 naêr 30/5/2019 ñông Boâ chinh tri lôm Ñai hoâi Ñang boâ rim kôp naêm truh Ñai hoâi Ñai bieâu toan quoâc maêng maê XIII ñông Ñang"
0021,"Xây dựng kế hoạch tổ chức đại hội các chi bộ, đảng bộ; chuẩn bị tốt công tác nhân sự cấp ủy đảm bảo chặt chẽ, đúng điều lệ, quy chế, quy định. Từ đó, tạo sự thống nhất cao về ý chí và hành động, lãnh đạo, chỉ đạo thực hiện tốt công tác chuẩn bị về mọi mặt để tổ chức thành công Đại hội Đảng các cấp tiến tới Đại hội Đại biểu toàn quốc lần thứ XIII của Đảng và thực hiện tốt nhiệm vụ chính trị của địa phương, đơn vị","Tôjung pôm glong pônhroh pôlok ñai hoâi rim chi boâ, ñang boâ; goâ ñech hôgei tôdrong nhaân sö kôp uy tômaên tôl kôjaêp, trô tro tôdrong. Ñông noh, pôm tôdrong thoâng nhaât lôm nöih sôngöm oeng tôdrong pôm, pôgôl pôm hôgei tôdrong goâ ñech lôm ñi ñaêng rim tôdrong sö pôlok keh kong Ñai hoâi Ñang rim kôp naêm truh Ñai hoâi Ñai bieâu toan quoâc maêng maê XIII ñông Ñang oeng pôm hôgei tôdrong chinh tri ñông cham pôlei, ñôn vi"
0022,"Thực hiện Chỉ thị số 35, ngày 30/5/2019 của Bộ Chính trị “về đại hội đảng bộ các cấp tiến tới Đại hội đại biểu toàn quốc lần thứ XIII của Đảng”, Ban Chấp hành Đảng bộ huyện đã ban hành Kế hoạch số 66-KH/TU, ngày 19.8.2019 về triển khai thực hiện đại hội đảng bộ các cấp","Pôm chi thi ksoâ 35 naêr 30/5/2019 ñông Boâ chinh tri lôm Ñai hoâi ñang boâ rim kôp naêm truh Ñai hoi ñai bieâu toan quoâc maêng maê XIII ñông Ñang, Khul chaâp hanh Ñang boâ huyeân jôh aên lech glong pônhroh ksoâ 66-KH/TU, naêr 19/8/2019 lôm pônhroh pôm ñai hoâi ñang boâ rim kôp"
0023,"Theo đó, Huyện ủy xác định Đại hội đảng bộ từ huyện đến cơ sở thực hiện 04 nội dung: Tổng kết việc thực hiện nghị quyết đại hội đảng bộ, chi bộ nhiệm kỳ 2015 - 2020 và xác định phương hướng, mục tiêu, nhiệm vụ, giải pháp của đảng bộ, chi bộ nhiệm kỳ 2020 - 2025","Boi noh, Huyeân uy pôtho khan Ñai hoâi ñang boâ ñông huyeân truh cô sô pôm 04 tôdrong: Toâng keât tôdrong pôm nghi quyeât ñai hoâi ñang boâ, chi boâ nhieâm ky 2015 – 2020 oeng pôtho khan tôdrong pôm ñông ñang boâ, chi boâ nhieâm ky 2020 – 2025"
0024,"Thảo luận, đóng góp ý kiến vào dự thảo các văn kiện Đại hội đại biểu toàn quốc lần thứ XIII của Đảng và dự thảo văn kiện đại hội đảng cấp trên trực tiếp","Pôñam bôl, pôgop y kieân tômöt dö thao rim vaên kieân ñai hoâi ñai bieâu toan quoâc maêng maê XIII ñông Ñang oeng dö thao vaên kieân ñai hoâi ñang kôp kôpöng trök tieâp"
0025,"Bầu ban chấp hành đảng bộ, chi bộ nhiệm kỳ 2020 - 2025","Bôu khul chôp hanh ñang boâ, chi boâ nhieâm ky 2020 – 2025"
0026,Bầu đoàn đại biểu dự đại hội đảng bộ cấp trên,Bôu khul naê ma pôgôl dö ñai hoâi ñang boâ kôp kôpöng
0027,"Những nơi có khó khăn liên quan đến công tác nhân sự, được cấp ủy có thẩm quyền đồng ý thì tiến hành đại hội với 3 nội dung, chưa thực hiện nội dung thứ 3 về bầu cấp ủy khóa mới","Rim dô no hrat tônap lieân quan truh tôdong nhaân sö, ñei kôp uy ôi thaâm quyeân ñoâng y thi pôlok ñai hoâi adring 03 tôdrong, ñim pôm tôdrong maêng maê 3 lôm bôu kôp uy khoa anao"
0028,"Về thời gian tiến hành đại hội: Đại hội các chi bộ trực thuộc đảng bộ cơ sở không quá 1 ngày, tổ chức trong quý I năm 2020 và hoàn thành trước ngày 31.3.2020","Lôm jônang pôlok ñai hoâi: Ñai hoâi rim chi boâ trök thuoâc ñang boâ cô sô bi loi 01 naêr, pôlok lôm quy I sônaêm 2020 oeng keh kong adrol naêr 31/3/2020"
0029,"Đại hội chi bộ cơ sở không quá 1 ngày, đại hội đảng bộ cấp cơ sở không quá 2 ngày; bắt đầu từ tháng 4/2020, hoàn thành trước ngày 30/6/2020","Ñai hoâi chi boâ cô sô bi loi 01 naêr, ñai hoâi ñang boâ cô sô bi loi 02 naêr; pôlok pôm ñông khei 4/2020, keh kong adrol naêr 30/6/2020"
0030,Đại hội đại biểu Đảng bộ huyện lần thứ XVIII dự kiến tổ chức vào tháng 8 năm 2020,Ñai hoâi ñai bieâu Ñang boâ huyeân maêng maê XVIII pôtho khan pôlok tômöt khei 8/2020