ID,Tiếng Việt,Tiếng BaNa
0001,"Sáng ngày 10.10, Đoàn Kiểm tra thực hiện phong trào toàn dân đoàn kết xây dựng đời sống văn hoá do Thứ Trưởng, Phó Chủ nhiệm Uỷ ban Dân tộc Hoàng Thị Hạnh làm Trưởng đoàn đã kiểm tra việc thực hiện Phong trào “Toàn dân đoàn kết xây dựng đời sống văn hoá” và Chương trình 135, Quyết định số 45 ngày 09.01.2019 của Thủ tướng Chính phủ trên địa bàn huyện Vĩnh Thạnh","Bôgheâ naêr 10/10, khul ngo hnhei tôdrong pôm trong glong ñi ñaêng naê ma ñoan keât kôjaêp tôjung pôm tôdrong yaêl arih alöng lieâm yua Thö tröông, Pho chu nhieâm Uy ban kon koâng Hoang thi Hanh pôm pôgôl jôh ngo hnhei tôdrong pôm trong glong ñi ñaêng naê ma ñoan keât kôjaêp tôjung pôm tôdrong yaêl arih alöng lieâm oeng chöông trinh 135, Quyeât ñinh ksoâ 45 ñông Thu töông kôpal teh ñak lôm tôring huyeân Vinh Thanh"
0002,"Cùng đi có đ/c Trương Đông Hải - Phó Giám đốc Sở Văn hoá và Thể thao, Tiếp và làm việc với đoàn có đ/c Huỳnh Đức Bảo - Phó Chủ tịch UBND huyện","Adring naêm ôi ñ/c Tröông Ñoâng Hai – Pho giam ñoâc Sô vaên hoa oeng theâ thao tinh, Tieâp adring pôm bieâk adring khul ngo hnhei ôi ñ/c Huynh Ñöc Bao – Pho chu tich UBND huyeân"
0003,"Theo báo cáo của UBND huyện Vĩnh Thạnh, thời gian qua, được sự quan tâm chỉ đạo của cấp ủy, chính quyền từ huyện tới cơ sở, đặc biệt là dưới sự lãnh đạo của Thường trực Huyện ủy","Boi pôtho khan ñông UBND huyeân Vinh Thanh, jônang anu yuoâ ôu, ñei tôdrong ngo hnhei pôgôl ñông kôp uy, khul pôgôl ñông huyeân truh cô sô, pôgloh la tôdrong pôgôl ñông thöông trök Huyeân uy"
0004,"Sự chỉ đạo điều hành quyết liệt của lãnh đạo UBND huyện, sự tham mưu của Ban Chỉ đạo Phong trào huyện, sự tích cực vào cuộc của cán bộ cơ sở và sự đồng tình hưởng ứng của của đông đảo đảng viên, cán bộ và nhân dân trên địa bàn, phong trào “Toàn dân đoàn kết xây dựng đời sống văn hoá” đã thực sự đi vào đời sống","Tôdrong pôgôl pôgloh ñông UBND huyeân, tôdrong pôñam bôl ñon ñông khul pôgôl trong glong huyeân, tôdrong pôjaêng tômöt pôm ñông kang boâ cô sô oeng tôdrong höông öng ñông lö ñang vieân, kang boâ oeng kon tôring lôm tôring huyeân, trong glong ñi ñaêng naê ma ñoan keât kôjaêp tôjung pôm tôdrong yaêl arih alöng lieâm jôh tôpaê naêm tômöt tôdrong yaêl arih"
0005,"Trở thành một phong trào thi đua yêu nước rộng lớn của quần chúng, ngày càng phát triển mạnh mẽ, mang lại những thành tựu to lớn, toàn diện và sâu sắc","Ñei ngo la minh trong glong tôjroh amem teh ñak pơgloh saê ñông naê ma, naêr kang pôjing deâh, chep aên lö tôdrong pôgloh"
0006,Chất lượng phong trào Toàn dân đoàn kết xây dựng đời sống văn hoá trên địa bàn huyện đã ngày càng được nâng cao,Tôdrong thu yok ñei trong glong ñi ñaêng naê ma ñoan keât kôjaêp tôjung pôm tôdrong yaêl arih alöng lieâm lôm tôring huyeân jôh naêr ñei poâk xuoân
0007,"Các phong trào luôn giành sự quan tâm của các cấp, các ngành và của toàn xã hội","Rim trong glong dech yok ñei tôdrong ngo hnhei ñông rim kôp, rim nganh oeng ñi ñaêng xa hoâi"
0008,"Nhân dân tin tưởng vào chủ trương của Đảng, chính sách pháp luật của Nhà nước; tích cực tham gia xây dựng Đảng, xây dựng chính quyền, nhất là phong trào xây dựng Nông thôn mới được triển khai có hiệu quả, góp phần thay đổi diện mạo nông thôn trên địa bàn, góp phần quan trọng nâng cao nhận thức của toàn xã hội về vai trò của văn hóa đối với sự phát triển","Kon tôring lui tômöt tôdrong ñông Dang, chinh sach phap luaât ñông kôpal; pôjaêng adring tôjung pôm Ñang, tôjung pôm khul pôgôl, pôgloh la trong glong tôjung pôm cham pôlei anao ñei pônhroh ôi thu yok, pôgop tôdrong pôm tôplih tôdrong cham pôlei lôm tôring, pôgop tôdrong pôgloh poâk xuoân tôdrong baêt ñông ñi ñaêng xa hoâi lôm vai tro ñông vaên hoa adring tôdrong pôjing"
0009,"Phong trào đã có tác động tích cực đến phát triển kinh tế và văn hóa - xã hội như truyền thống đoàn kết và đạo lý dân tộc được phát huy trở thành nội lực giúp nhau “Xóa đói giảm nghèo”, “Đền ơn đáp nghĩa”","Trong glong jôh ôi tôdrong pôjaêng truh pôjing kinh teâ oeng vaên hoa – xa hoâi in: tôdrong ñoan keât oeng tôdrong kon koâng ñei pôjing ñei ngo la tôdrong tôgum adring tuk bôngot dônuh, ñeân ôn ñap nghia"
0010,"Nhiều giá trị văn hóa, các quy định pháp luật và quy chế, quy tắc ứng xử văn hóa ngày càng thâm nhập vào đời sống đã góp phần quan trọng tạo dựng môi trường sống lành mạnh cho cộng đồng dân cư, cho mỗi gia đình và cá nhân","Lö giaê tri vaên hoa, rim tôdrong phap luaât oeng quy cheâ, quy taêc öng xö vaên hoa naêr kang naêm tômöt tôdrong yaêl arih jôh pôgop tôdrong pôgloh pôm moâi tröông yaêl arih alöng lieâm aên naê ma cham pôlei, aên rim unh hnam oeng kôdih ôkôu"
0011,"Vai trò, vị trí của gia đình và cộng đồng được nâng lên trong xây dựng đời sống văn hóa; tình làng, nghĩa xóm được củng cố, thực hiện nếp sống văn minh trong việc cưới, việc tang và lễ kỷ niệm có tiến bộ ở nhiều nơi","Vai tro, vi tri ñông unh hnam oeng naê ma cham pôlei ñei poâk xuoân lôm tôjung pôm tôdrong yaêl arih vaên hoa; pôm tôdrong yaêl arih vaên minh lôm tôdrong aêng mai, tôdrong bu ataêu oeng maêng ky nieâm ôi tôdrong tôplih oei lö cham pôlei"
0012,"Nhiều giá trị văn hóa dân tộc được bảo tồn, phát huy làm phong phú đời sống văn hóa của nhân dân ở cơ sở; hệ thống thiết chế văn hóa cơ sở tiếp tục duy trì, phát triển, góp phần nâng cao mức hưởng thụ văn hóa của người dân","Lö giaê tri vaên hoa kon koâng ñei jö vei, pôjing pôm alöng tôdrong yaêl arih vaên hoa ñông kon tôring oei cô sô; heâ thoâng thieât cheâ vaên hoa cô sô ling lang ñei duy tri, pôjing, pôgop tôdrong poâk xuoân tôdrong höông thu vaên hoa ñông naê ma"
0013,"Ghi nhận những chuyển biến, nâng cao chất lượng phong trào trên địa bàn huyện Vĩnh Thạnh trong thời gian qua, Thứ trưởng, Phó Chủ nhiệm Uỷ ban Dân tộc Hoàng Thị Hạnh nhấn mạnh: Đảng, Nhà nước đặc biệt quan tâm đến các hoạt động của phong trào","Ghi nhaân rim tôplih, poâk xuoân tôdrong thu yok ñei trong glong lôm tôring huyeân Vinh Thanh lôm jônang anu yuoâ ôu, Thö tröông, Pho chuû nhieâm Uy ban kon koâng Hoang Thi Hanh pôñam: Ñang, kôpal pôgloh ngo hnhei truh rim tôdrong pôm ñông trong glong"
0014,"Năm 2018, Thủ tướng Chính phủ đã chủ trì Hội nghị trực tuyến toàn quốc tổng kết 18 năm thực hiện phong trào","Sônaêm 2018, Thu töông kôpal teh ñak jôh pôgôl Hoâi nghi trök tuyeân toan quoâc toâng keât 18 sônaêm pôm trong glong"
0015,Những chỉ đạo của Thủ tướng tại Hội nghị này có ý nghĩa đặc biệt quan trọng,Lö pôgôl ñông Thu töông lôm Hoâi nghi anu ôi y nghi pôgloh
0016,"Đối với từng địa phương, những nội dung mới nhằm nâng cao chất lượng phong trào có đi vào đời sống hay không phải bắt đầu từ cơ sở, từ sự chủ động và tự nguyện của người dân","Adring rim cham pôlei, lö tôdrong anao sö poâk xuoân tôdrong thu yok ñei trong glong ôi naêm tômöt tôdrong yaêl arih thoi bi phai naêm pôtôm ñông cô sô, ñông tôdrong chu ñoâng oeng kôdih ñông naê ma"
0017,"Cũng ghi nhận những đề xuất, kiến nghị của Ban chỉ đạo phong trào huyện, Thứ trưởng lưu ý, cần tiếp tục chú trọng nội dung xây dựng Gia đình văn hóa, nâng cao chất lượng danh hiệu theo tinh thần của Nghị định 122, xác định gia đình là nền tảng, tế bào của xã hội, cần quan tâm nhiều hơn nữa đến việc giáo dục đạo đức, lối sống trong mỗi gia đình","Kung ghi yok rim tôdrong ñeâ xuaât, kieân nghi ñông khul pôgôl trong glong huyeân, Thö tröông pôkaê, waê ling lang ngo hnhei tôdrong tôjung pôm unh hnam vaên hoa, poâk xuoân tôdrong thu yok ñei danh hieâu boi nöih sôngöm ñông Nghi ñinh 122, pôtho khan unh hnam la tôdrong pôgloh ñông xa hoâi, waê ngo hnhei lö loi pieâu truh tôdrong giao duc nöih sôngöm, tôdrong yaêl arih lôm rim unh hnam"
0018,"Ngày 19.10, Ban Nữ công, Công đoàn Văn phòng UBND tỉnh tổ chức thăm, giao lưu và tặng quà cho đơn vị kết nghĩa Hội LHPN xã Vĩnh Hòa, huyện Vĩnh Thạnh","‘Naêr 19/10, Khul nö coâng, Coâng ñoan vaên phong UBND tinh pôloêk maêng giao löu oeêng aên qua aên ñôn vi keât nghia Hoâi LHPN xa Vinh Hoa, huyeân Vinh Thanh"
0019,"Tại buổi gặp mặt, giao lưu, ngoài việc ôn lại truyền thống vẻ vang của Hội LHPN Việt Nam trong 89 năm qua. Đại diện lãnh đạo Hội LHPN xã Vĩnh Hòa báo cáo những kết quả hoạt động của Hội phụ nữ xã trong thời gian qua và ghi nhận với sự giúp đỡ, hỗ trợ của Ban Nữ công, Công đoàn Văn phòng UBND tỉnh về vật chất đã giúp cho nhiều chị em hội viên của xã là dân tộc thiểu số vùng cao khó khăn, có điều kiện ổn định và phát triển kinh tế gia đình, góp phần vào mục tiêu xóa đói giảm nghèo của địa phương","Dônoê maêng tôjröêm maêt, jao löu, minh kôpah tôdrong pôñam ‘bôl tôdrong pôgloh ñôêng Hoâi LHPN Vieât Nam lôêm 89 sônaêm anu yuoâ ôêu. Ñai dieân pôgôl Hoâi LHPN xa Vinh Hoa jôh pôtho khan rim thu yoêk ñôêng Hoâi mai oh xa lôêm jônang anu yuoâ ôêu oeêng ghi yoêk adring tôdrong tôguêm ñôêng khul nö coâng, coâng ñoan vaên phong UBND tinh lôêm vaât chaât jôh tôguêm aên lö mai oh ñôêng xa la mai oh kon koâng apung koâng hrat tônap ôêi tôdrong alöng oeêng pôjing kinh teâ uênh hnam, pôgoêp tômöt tôdrong tuêk bôngot dônuh ñôêng cham pôlei"
0020,"Nhân dịp này, Ban Nữ công, Công đoàn Văn phòng UBND tỉnh đã tặng cho Hội LHPN xã Vĩnh Hòa 1 bộ máy vi tính và 1 máy in; tặng 1 bộ loa cho Làng M6 và trao tặng 120 suất quà cho các em học sinh khó khăn, phụ nữ nghèo, các hộ gia đình có hoàn cảnh đặc biệt khó khăn, tổng số tiền các suất quà trao tặng trị giá hơn 30 triệu đồng","Maêng maê anu, Khul nö coâng, coâng ñoan vaên phong UBND tinh jôh aên Hoâi LHPN xa Vinh Hoa 01 boâ may vi tinh oeêng 01 may in; aên 01 boâ loa aên pôlei M6 oeêng aên 120 suaât qua aên rim ñe hô yoh hoêk sinh ôêi tôdrong hrat tônap, mai oh dônuh, rim uênh hnam ôêi tôdrong pôgloh hrat tônap adriêng pôting ksoÊâ jeân loi 30 trieâu ñoâng"