Tiếng Việt,Tiếng BaNa
"Ngày đầu tiên bước vào Trường PTDTNT THCS&THPT Vĩnh Thạnh, em Đinh Thị Thúy Hằng, ở làng Klot Pok, thị trấn Vĩnh Thạnh khá bỡ ngỡ","‘Naêr pôtôm naêm tômöt Tröông PTDTNT THCS&THPT Vinh Thanh, oh Ñinh Thi Thuy Haêng, oei pôlei Klot Pok, thi traân Vinh Thanh khaê môlôêu"
"Trường mới, bạn bè mới, thầy cô mới","Tröông anao, ‘ban ‘be anao, bôngai pôtôêp pôtho anao"
"Được cô giáo chủ nhiệm đón ở khu nội trú, chỉ cho chỗ ở và hướng dẫn nội quy trường lớp mới, Hằng trở nên tự tin, vui vẻ hơn trong môi trường học tập mới","Ñei coâ chu nhieâm goâ oei khu noâi tru, pôchi aên dônoê oei oeêng pôtho khan noâi quy tröông lôp anao, Haêng jôh tö tin oeêng höch hanh loi lôêm moâi tröông hoêk tôp anao"
Em Đinh Thị Thúy Hằng bày tỏ cảm xúc của mình như thế này,Oh Ñinh Thi Thuy Haêng pôñam ‘bôl nöih sôngöm ñôn bôên in ôêu
"Đón học sinh vào năm học mới, hướng dẫn cho các em học sinh mới vào trường trong nhiều năm học qua luôn được nhà trường chú trọng","Yoêk hoêk sinh tômöt sônaêm anao, pôtho khan aên rim ñe oh hoêk sinh anao tômöt tröông lôêm lö sônaêm hoêk dach ñei hnam tröông ngoê hnhei"
"Các giáo viên chủ nhiệm lớp 6 luôn gần gũi, động viên cho các em làm quen và băt nhịp với môi trường mới để tạo cho các em cảm giác thân thiện trong môi trường học tập mới","Rim bôngai pôtôêp pôtho chu nhieâm lôêp 6 dach oei jeâÊ, potho khan aên rim ñe oh pôm quen adriêng moâi tröông anao söê pôm aên rim ñe oh ôi tôdrong yaêl arih alöng lôm moâi tröông hoêk tôêp anao"
"Cô giáo Đinh Thị Thủy - Giáo viên chủ nhiệm lớp 6A2, Trường PTDTNT THCS&THPT Vĩnh Thạnh cho biết","Duch Ñinh Thi Thuy – giao vieân chu nhieâm lôêp 6A2, Tröông PTDTNT THCS&THPT Vinh Thanh aên aleÊâ"
"Năm nay, trường có 462 học sinh ở 2 cấp học THCS&THPT","Sônaêm anu, Tröông ôêi 462 hoêk sinh oei 02 kôêp hoêk THCS&THPT"
"Lễ khai giảng năm học mới ở Trường PTDTNT THCS&THPT Vĩnh Thạnh bắt đầu bằng tiết mục biểu diễn cồng chiêng đón chào năm học mới nhằm tạo không khí vui tươi, phấn khởi cho học sinh là con em đồng bào các dân tộc trên địa bàn huyện",Leâ khai giang sônaêm hoêk anao oei Tröông PTDTNT THCS&THPT Vinh Thanh trong pôtôm la it ching phoâng chao sônaêm hoêk anao söê pôm tôdrong alöng aên hoêk sinh la kon mon naê ma kon koâng lôêm tôring huyeân
Trường PTDTNT THCS&THPT Vĩnh Thạnh có 100% học sinh là con em đồng bào các dân tộc,Tröông PTDTNT THCS&THPT Vinh Thanh ôêi 100% hoêk sinh la kon mon naê ma kon koâng
"Trước thềm năm học, nhà trường đã triển khai nhiều biện pháp tuyên truyền, vận động học sinh trở lại trường sau kỳ nghỉ hè nhằm đảm bảo sĩ số học sinh","Adrol sônaêm hoêk anao, hnam tröông jôh pônhroh lö tôdrong pôtho khan, krao akoêm hoêk sinh naêm truh tröông ñôêng roêng maêng pôdôêi he söê tômaên tôl si soÊâ hoêk sinh"
Thầy Từ Kim Lân - Hiệu trưởng Trường PTDTNT THCS&THPT Vĩnh Thạnh cho biết thêm,Thaây Tö Kim Laân – Hieâu tröông Tröông PTDTNT THCS&THPT Vinh Thanh aên baêt
"Hòa cùng niềm vui chung của các thầy giáo, cô giáo trên mọi miền đất nước, những tiếng cười, những bước chân rộn ràng đến trường của học sinh và những nỗ lực, niềm tin của thầy giáo, cô giáo vùng cao huyện Vĩnh Thạnh sẽ hứa hẹn một năm học mới với nhiều thành công","Adriêng tôdrong höch hanh ñôêng rim bôngai pôtôêp pôtho lôêm rim apung teh ñak, rim tôdrong höch hanh naêm truh tröông ñôêng hoêk sinh oeêng rim tôdrong pran ñôêng bôngai pôtôêp pôtho apung koâng Vinh Thanh pôkaê minh sônaêm hoêk anao adriêng lö tôdrong pôgloh"
"Nhân dịp Tết Trung thu năm 2019, huyện Vĩnh Thạnh tổ chức nhiều hoạt động vui Tết Trung thu cho các em thiếu nhi trên địa bàn huyện","Thoi maêng Teât trung thu sônaêm 2019, huyeân Vinh Thanh pôloêk lö tôdrong sôhmanh Teât trung thu aên rin ñe hôyoh lôêm tôring huyeân"
"Đồng thời, sẽ trích kinh phí từ nguồn quỹ Bảo trợ trẻ em huyện, tặng 40 suất quà cho trẻ em nghèo, trẻ em khuyết tật, trẻ em có hoàn cảnh đặc biệt ở hai xã Vĩnh Sơn và Vĩnh Kim, mỗi suất quà trị giá 200 nghìn đồng","Thoi ‘noh yoêk jeân ñôêng nguoân jeân Bao trô ñe hôyoh huyeân, aên 40 suaât qua aên ñe hôyoh dônuh, ñe hôyoh kue, ñe hôyoh ôêi tôdrong pôgloh hrat tônap oei 02 xa Vinh Sôn oeêng Vinh Kim, minh suaât qua 200 ôbôêu"
Phòng LĐ- TB và XH huyện phối hợp Huyện đoàn tổ chức các hoạt động vui chơi tập trung cho trẻ em như tổ chức Chương trình Ngày hội em yêu văn hóa dân gian; Chương trình Đêm hội Trăng rằm tại Trung tâm VH- TT-TT huyện và tặng 200 suất quà cho trẻ em trên địa bàn huyện,Phong LÑ-TB&XH huyeân adriêng Huyeân ñoan pôloêk rim tôdrong sôhmanh aên rim ñe hôyoh in: Pôloêk chöông trinh ‘naêr hoâi ñe hôyoh ameêm vaên hoa daân gian; Chöông trinh ñeâm hoâi traêng raêm dônoê Trung taâm VH-TT-TT huyeân oeêng aên 200 suaât qua aên ñe hôyoh lôêm tôring huyeân
"Bên cạnh đó, UBND huyện Vĩnh Thạnh chỉ đạo các ngành, đoàn thể liên quan và các địa phương, tổ chức các hoạt động vui tết Trung thu cho trẻ em trong huyện","Minh kôpah ‘noh, UBND huyeân Vinh Thanh pôgôl rim nganh, ñoan theâ lieân quan oeêng rim cham pôlei pôloêk rim tôdrong sôhmanh Teât trung thu aên ñe hôyoh lôêm huyeân"
"Các xã, thị trấn xây dựng kế hoạch cụ thể và bố trí kinh phí để tổ chức các hoạt động vui tết Trung thu cho trẻ em ở địa phương mình","Rim xa, thi traân tôjung pôm glong pônhroh cu theâ oeêng tôguêm jeân söê pôloêk tôdrong sôhmanh teât trung thu aên ñe hôyoh oei cham pôlei bôên"
"Trong đó, tổ chức một điểm vui chơi tập trung cho trẻ em tại các thôn, làng, với các hoạt động vui chơi như: tổ chức các trò chơi dân gian, múa lân, văn nghệ, phá cỗ…kết hợp biểu dương, đi thăm tặng quà cho trẻ em thuộc hộ nghèo, trẻ em có hoàn cảnh đặc biệt khó khăn","Lôêm ‘noh, pôloêk minh dônoê sôhmanh pônhoâm  aên ñe hôyoh lôêm rim thoân, pôlei adriêng rim tôdrong sôhmnah in: pôloêk rim tro chôi daân gian, mua laân, choh xoang, phaê coâ… adriêng bône, naêm tômang aên kua aên ñe hôyoh oei lôêm kôbraê uênh hnam dônuh, ñe hôyoh ôêi tôdrong pôgloh hrat tônap"
"Qua đây, nhằm tạo cơ hội cho mọi trẻ em trên địa bàn huyện được tham gia đón tết Trung thu năm 2019 vui vẻ, đầm ấm, an toàn, lành mạnh","Kua ôêu, söê pôm tôdrong aên rim ñe hôyoh lôêm tôring huyeân ñei adriêng sôhmanh teât trung thu sônaêm 2019 höch hanh oeêng alöng lieâm"
"Thời gian qua, trên cơ sở chủ trương, chính sách của Đảng và Nhà nước, UBND huyện đã ban hành kịp thời văn bản chỉ đạo để hướng dẫn thực hiện nhiệm vụ giáo dục DTTS và miền núi; xây dựng kế hoạch triển khai phù hợp với tình hình đặc điểm của địa phương, đồng thời chỉ đạo tổ chức hiệu quả các hoạt động trọng tâm nhằm nâng cao chất lượng dạy, học đối với giáo viên và học sinh DTTS, đặc biệt là đối với trường PTDT bán trú","Jônang anu yuoâ ôêu, lôêm tôdrong ñôêng Ñang oeêng kôpal, UBND huyeân jôh aên leêch tôtam vaên ‘ban pôgôl söê pôtho khan pôm tôdrong giao duc hoêk sinh kon koâng oeêng apung koâng; tôjung pôm glong pônhroh pônhroh trô troê adriêng tôdrong ñôêng rim cham pôlei, thoi ‘noh, pôgôl pôloêk pôm ôêi thu yoêk rim tôdrong pôgloh söê poâk xuoân tôdrong thu yoêk ñei tôdrong pôtôêp oeêng hoêk adriêng bôngai pôtôêp pôtho oeêng hoêk sinh kon koâng, pôgloh la adriêng Tröông PTDT ‘ban truê"
"Cùng với đó, các cấp, ngành và địa phương đầu tư, lồng ghép, huy động các nguồn vốn hỗ trợ xây dựng, cải tạo cơ sở vật chất, mua sắm trang thiết bị cho hệ thống trường PTDT Bán trú","Adriêng ‘noh, rim kôêp, nganh oeêng cham pôlei tôguêm, pôteêp, krao akoêm rim nguoân jeân tôguêm tôjung pôm, cai tao cô sô vaât chaât, ruoât ñoâ aên heâ thoÊâng Tröông PTDT ‘ban truê"
"Đồng thời sử dụng nguồn ngân sách địa phương, xã hội hóa nguồn kinh phí, vận động phụ huynh học sinh hỗ trợ vật chất nhằm tăng cường cơ sở vật chất, trang thiết bị dạy học tại các trường bán trú trên địa bàn huyện","Thoi ‘noh chaê yuoâ nguoân jeân ñôêng cham pôlei, xa hoâi hoa nguoân jeân, krao akoêm miê baê hoêk sinh tôguêm vaât chaât söê kjung cô sô vaât chaât, ñoâ pôtôêp lôêm rim tröông ‘ban truê lôêm tôring huyeân"
"Công tác giáo dục và đào tạo nâng cao trình độ dân trí của đồng bào DTTS luôn được các cấp chính quyền quan tâm thực hiện việc xây dựng, trang bị cơ sở vật chất, thiết bị dạy và học, nâng cao chất lượng giảng dạy của đội ngũ giáo viên","Tôdrong giao duc oeêng ñao tao poâk xuoân tôdrong baêt ñôêng naê ma kon koâng deêch ñei khul pôgôl ngoê hnhei pôm, Tôdrong tôjung pôm, trang bi cô sô vaât chaât, ñoâ pôtôêp oeêng hoêk, poâk xuoân tôdrong thu yoêk ñei trong pôtôêp ñôêng ñoâi ngu bôngai pôtôêp pôtho deêch ñei ngoê hnhei tôguêm"
"UBND huyện chỉ đạo triển khai thực hiện đầy đủ các chế độ chính sách với con em đồng bào DTTS như: Cấp phát tập vở, hỗ trợ gạo, tiền ăn uống, sinh hoạt và các nhu cầu cá nhân khác để tạo điều kiện cho các em học tập tốt","UBND huyeân pôgôl pônhroh pôm duh rim tôdrong adriêng kon mon naê ma kon koâng in: kôp hla al, tôguêm pheâ, jeân sa eêt, sinh hoat oeêng rim tôdrong nai söê pôm tôdrong aên rim ñe hôyoh hoêk tôp hôgei"
"Thực hiện tốt công tác huy động trẻ em DTTS đến trường đúng tuổi, vận động số học sinh người DTTS bỏ học trở lại trường","Pôm hôgei tôdrong krao akoêm ñe hôyoh truh tröông troê sônaêm, krao akoêm ksoâÊ hoêk sinh la kon mon naê ma kon koâng tuêk hoêk naêm hoêk pieâu"
"Sở Văn hoá - Thể thao tỉnh vừa có kế hoạch tổ chức giao lưu văn hoá dân tộc thiểu số và công tác gia đình năm 2019 tại Làng K8, xã Vĩnh Sơn với các nội dung:  Giao lưu, chia sẻ kinh nghiệm về xây dựng và phát triển văn hoá dân tộc thiểu số, xây dựng đời sống văn hoá cơ sở, xây dựng gia đình no ấm, tiến bộ, hạnh phúc; Trình diễn nghệ thuật bài chòi dân gian và Hội làng","Sô vaên hoa theâ thao tinh anao ôêi glong pônhroh pôloêk giao löu vaên hoa naê ma kon koâng oeêng tôdrong uênh hnam sônaêm 2019 dônoê pôlei K8, xa Vinh Sôn adriêng rim tôdrong: Giao löu, asong kinh nghieâm lôêm tôjung pôm oeêng pôjing vaên hoa naê ma kon koâng, tôjung pôm tôdrong yaêl arih vaên hoa cô sô, tôjung pôm uênh hnam alöng lieâm; trinh dieân ngheâ thuaât ‘bai choi daân gian oeêng Hoâi pôlei"
Đây là hoạt động nhằm nâng cao nhận thức cho tầng lớp nhân dân tham gia xây dựng và phát triển văn hoá các dân tộc thiểu số; bảo vệ và phát huy các giá trị văn hoá truyền thống tốt đẹp ở địa phương,Anu la tôdrong pôm söê poâk xuoân tôdrong baêt aên ñiê ñaêng naê ma adriêng tôjung pôm oeêng pôjing vaên hoa rim naê ma kon koâng; jö vei oeêng pôjing rim tôdrong vaên hoa ñôêng sôê alöng lieâm oei cham pôlei
"Đồng thời, tạo sự chuyển biến mạnh mẽ về nhận thức trong xây dựng gia đình no ấm, tiến bộ, hạnh phúc; phòng chống bạo lực gia đình; bài trừ hủ tục lạc hậu trong cộng đồng khu dân cư, góp phần tích cực trong phong trào xây dựng gia đình văn hoá, làng văn hoá, xã đạt chuẩn văn hoá nông thôn mới","Thoi ‘noh pôm tôdrong tôplih deâh lôêm tôdrong baêt lôêm tôjung pôm uênh hnam alöng lieâm; phong dôt ‘bao lök uênh hnam; tuêk rim tôdrong lac haâu lôêm apung naê ma cham pôlei, pôgoêp tôdrong pôjaêng lôêm trong glong tôjung pôm uênh hnam vaên hoa, pôlei vaên hoa, xa ñat chuaân vaên hoa cham pôlei anao"
"Sáng ngày 1.10, tại Trung tâm hoạt động Thanh thiếu nhi, UBND huyện Vĩnh Thạnh tổ chức Lễ khai mạc Tuần lễ hưởng ứng học tập suốt đời năm 2019 với chủ đề ""Học tập suốt đời - Học tập thông minh để trở thành công dân tốt, xây dựng gia đình hạnh phúc, xã hội văn minh"".","Sáng ngày 1.10, tại Trung tâm hoạt động Thanh thiếu nhi, UBND huyện Vĩnh Thạnh tổ chức Lễ khai mạc Tuần lễ hưởng ứng học tập suốt đời năm 2019 với chủ đề ""Học tập suốt đời - Học tập thông minh để trở thành công dân tốt, xây dựng gia đình hạnh phúc, xã hội văn minh""."
"Tuần lễ diễn ra tại tất cả các xã, thị trấn trên địa bàn huyện từ ngày 1 đến ngày 7/10/2019 với nhiều nội dung như tổ chức các lớp bồi dưỡng chuyên môn, nghiệp vụ, lý luận chính trị cho cán bộ, công chức, viên chức, công nhân lao động; các lớp đào tạo nghề cho lao động nông thôn; tăng cường tuyên truyền Tuần lễ hưởng ứng học tập suốt đời; phát động phong trào thi đua dạy tốt, học tốt; tổ chức các hoạt động khuyến học, thể dục thể thao, văn hóa, văn nghệ...","Tuaân leâ ñei pôlok lôm ñi ñaêng rim xa, thi traân lôm tôring huyeân ñông naêr 01 truh naêr 07/10/2019 adring lö tôdrong in: pôlok rim lôp tôgum chuyeân moân nghieâp vu, ly luaân chinh tri aên kang boâ, coâng chöc, vieân chöc oeng ñi ñaêng naê ma, rim lôp pô tôp ngheâ aên naê ma cham pôlei; kjung pôtho khan tuaân leâ höông öng hok tôp truh atuoâch; pôm trong glong tôjroh pô tôp hôgei, hok hôgei; pôlok rim tôdrong khuyeân hok, TDTT, choh xoang…"
"Trong thời gian qua, phong trào thi đua xây dựng gia đình hiếu học, dòng họ hiếu học, cộng đồng khuyến học đã được quan tâm đẩy mạnh và được xác định là nhiệm vụ trọng tâm.","Tôm jônang anu yuoâ ôu, trong glong tôjroh tôjung pôm unh hnam kô waê hok, naê ma cham pôlei khuyeân hok jôh ñei ngo hnhei jôraê deâh oeng ñei ngo la tôdrong pôgloh."
"Vì thế, số gia đình đăng ký đạt danh hiệu gia đình hiếu học ở các cấp, các đơn vị tăng nhanh.","Yua noh, ksoâ unh hnam ñaêng ky ñat tôdrong unh hnam kô waê hok oei rim kôp, rim ñôn vi kjung deâh."
"Có nhiều tấm gương sáng, những hạt nhân quý báu cần được nhân rộng tại các địa phương trong toàn huyện, giúp cho đẩy mạnh phong trào học tập trong và ngoài nhà trường, góp phần giữ vững thành quả phổ cập mầm non trẻ 5 tuổi, phổ cập giáo dục tiểu học đúng độ tuổi và phổ cập THCS.","Ôi lö nöih sôngöm pôgloh waê ñei pôlok saê rim cham pôlei lôm huyeân, tôgum jôraê deâh trong glong hok tôp lôm oeng ôgah tröông, pôgop tôdrong jö kôjaêp tôdrong phoâ kôp maâm non ñe hôyoh 05 sônaêm, phoâ kôp giao duc tieâu hok trô tro sônaêm oeng phoâ kôp THCS."
"Phát biểu khai mạc Tuần lễ hưởng ứng học tập suốt đời năm 2019, Phó Chủ tịch UBND huyện Huỳnh Đức Bảo khẳng định: Tuần lễ hưởng ứng học tập suốt đời là dịp tiếp tục tôn vinh, gìn giữ và phát huy truyền thống hiếu học quý báu của dân tộc Việt Nam.","Pôñam bôl khai mac tuaân leâ höông öng hok tôp truh atuoâch sônaêm 2019, Pho chu tich UBND huyeân Huynh Ñöc Bao khan: Tuaân leâ höông öng hok tôp truh atuoâch la maêng ling lang bône, jö vei oeng pôjing tôdrong kô waê hok ñông bôngai Vieât Nam."
"Quán triệt và nhận thức sâu sắc các quan điểm đó, trong những năm qua, Huyện ủy, HĐND, UBND huyện đã thường xuyên quan tâm chỉ đạo, tạo nhiều điều kiện thuận lợi cho các cấp Hội khuyến học hoạt động.","Quan trieât oeng baêt pôgloh rim tôdrong noh, lôm lö sônaêm anu yuoâ ôu, Huyeân uy, HÑND, UBND huyeân jôh dach ngo hnhei pôgôl, pôm lech lö tôdrong alöng aên rim kôp hoâi khuyeân hok pôm."
"Vì vậy, phong trào thi đua khuyến học, khuyến tài đã phát triển cả bề rộng và chiều sâu, hệ thống tổ chức của hội được kiện toàn, củng cố và lan tỏa đến khắp từ các xã miền núi vùng cao đến các xã, thị trấn trong huyện, trở thành tổ chức hội có tỷ lệ tập hợp hội viên cao nhất.","Yua noh, trong glong tôjroh khuyeân hok, khuyeân tai jôh pôjing lôm lö tôdrong, tôdrong toâ chöc ñông hoâi ñei kieân toan, cung coâ oeng apoh truh ñi ñaêng rim xa apung koâng truh rim xa, thi traân lôm huyeân, jôh ñei toâ chöc hoâi ôi ty leâ pônhoâm naê ma lö pôgloh."
"Nội dung, hình thức hoạt động của Hội khuyến học có nhiều đổi mới, chất lượng hoạt động ngày càng được nâng cao; đã thực hiện đúng chủ trương gắn kết giữa hệ thống giáo dục chính quy trong nhà trường với hệ thống học tập ngoài xã hội, để xây dựng một xã hội học tập thực hiện mục tiêu đào tạo con người toàn diện, có ích cho xã hội.","Tôdrong pôm ñông Hoâi khuyeân hok ôi lö tôplih anao, tôdrong thu yok ñei naêr kang ñei poâk xuoân; jôh pôm tro tôdrong pôtep tôk pôk tôdrong giao duc chinh quy lôm hnam tröông adring tôdrong hok tôp ñông xa hoâi, sö tôjung pôm minh xa hoâi hok tôp pôm tôdrong ñao tao bôngai alöng aên xa hoâi."
"Sáng ngày 10.10, Đoàn Kiểm tra thực hiện phong trào toàn dân đoàn kết xây dựng đời sống văn hoá do Thứ Trưởng, Phó Chủ nhiệm Uỷ ban Dân tộc Hoàng Thị Hạnh làm Trưởng đoàn đã kiểm tra việc thực hiện Phong trào “Toàn dân đoàn kết xây dựng đời sống văn hoá” và Chương trình 135, Quyết định số 45 ngày 09.01.2019 của Thủ tướng Chính phủ trên địa bàn huyện Vĩnh Thạnh","Bôgheâ naêr 10/10, khul ngo hnhei tôdrong pôm trong glong ñi ñaêng naê ma ñoan keât kôjaêp tôjung pôm tôdrong yaêl arih alöng lieâm yua Thö tröông, Pho chu nhieâm Uy ban kon koâng Hoang thi Hanh pôm pôgôl jôh ngo hnhei tôdrong pôm trong glong ñi ñaêng naê ma ñoan keât kôjaêp tôjung pôm tôdrong yaêl arih alöng lieâm oeng chöông trinh 135, Quyeât ñinh ksoâ 45 ñông Thu töông kôpal teh ñak lôm tôring huyeân Vinh Thanh"
"Cùng đi có đ/c Trương Đông Hải - Phó Giám đốc Sở Văn hoá và Thể thao, Tiếp và làm việc với đoàn có đ/c Huỳnh Đức Bảo - Phó Chủ tịch UBND huyện","Adring naêm ôi ñ/c Tröông Ñoâng Hai – Pho giam ñoâc Sô vaên hoa oeng theâ thao tinh, Tieâp adring pôm bieâk adring khul ngo hnhei ôi ñ/c Huynh Ñöc Bao – Pho chu tich UBND huyeân"
"Theo báo cáo của UBND huyện Vĩnh Thạnh, thời gian qua, được sự quan tâm chỉ đạo của cấp ủy, chính quyền từ huyện tới cơ sở, đặc biệt là dưới sự lãnh đạo của Thường trực Huyện ủy","Boi pôtho khan ñông UBND huyeân Vinh Thanh, jônang anu yuoâ ôu, ñei tôdrong ngo hnhei pôgôl ñông kôp uy, khul pôgôl ñông huyeân truh cô sô, pôgloh la tôdrong pôgôl ñông thöông trök Huyeân uy"
"Sự chỉ đạo điều hành quyết liệt của lãnh đạo UBND huyện, sự tham mưu của Ban Chỉ đạo Phong trào huyện, sự tích cực vào cuộc của cán bộ cơ sở và sự đồng tình hưởng ứng của của đông đảo đảng viên, cán bộ và nhân dân trên địa bàn, phong trào “Toàn dân đoàn kết xây dựng đời sống văn hoá” đã thực sự đi vào đời sống","Tôdrong pôgôl pôgloh ñông UBND huyeân, tôdrong pôñam bôl ñon ñông khul pôgôl trong glong huyeân, tôdrong pôjaêng tômöt pôm ñông kang boâ cô sô oeng tôdrong höông öng ñông lö ñang vieân, kang boâ oeng kon tôring lôm tôring huyeân, trong glong ñi ñaêng naê ma ñoan keât kôjaêp tôjung pôm tôdrong yaêl arih alöng lieâm jôh tôpaê naêm tômöt tôdrong yaêl arih"
"Trở thành một phong trào thi đua yêu nước rộng lớn của quần chúng, ngày càng phát triển mạnh mẽ, mang lại những thành tựu to lớn, toàn diện và sâu sắc","Ñei ngo la minh trong glong tôjroh amem teh ñak pơgloh saê ñông naê ma, naêr kang pôjing deâh, chep aên lö tôdrong pôgloh"
Chất lượng phong trào Toàn dân đoàn kết xây dựng đời sống văn hoá trên địa bàn huyện đã ngày càng được nâng cao,Tôdrong thu yok ñei trong glong ñi ñaêng naê ma ñoan keât kôjaêp tôjung pôm tôdrong yaêl arih alöng lieâm lôm tôring huyeân jôh naêr ñei poâk xuoân
"Các phong trào luôn giành sự quan tâm của các cấp, các ngành và của toàn xã hội","Rim trong glong dech yok ñei tôdrong ngo hnhei ñông rim kôp, rim nganh oeng ñi ñaêng xa hoâi"
"Nhân dân tin tưởng vào chủ trương của Đảng, chính sách pháp luật của Nhà nước; tích cực tham gia xây dựng Đảng, xây dựng chính quyền, nhất là phong trào xây dựng Nông thôn mới được triển khai có hiệu quả, góp phần thay đổi diện mạo nông thôn trên địa bàn, góp phần quan trọng nâng cao nhận thức của toàn xã hội về vai trò của văn hóa đối với sự phát triển","Kon tôring lui tômöt tôdrong ñông Dang, chinh sach phap luaât ñông kôpal; pôjaêng adring tôjung pôm Ñang, tôjung pôm khul pôgôl, pôgloh la trong glong tôjung pôm cham pôlei anao ñei pônhroh ôi thu yok, pôgop tôdrong pôm tôplih tôdrong cham pôlei lôm tôring, pôgop tôdrong pôgloh poâk xuoân tôdrong baêt ñông ñi ñaêng xa hoâi lôm vai tro ñông vaên hoa adring tôdrong pôjing"
"Phong trào đã có tác động tích cực đến phát triển kinh tế và văn hóa - xã hội như truyền thống đoàn kết và đạo lý dân tộc được phát huy trở thành nội lực giúp nhau “Xóa đói giảm nghèo”, “Đền ơn đáp nghĩa”","Trong glong jôh ôi tôdrong pôjaêng truh pôjing kinh teâ oeng vaên hoa – xa hoâi in: tôdrong ñoan keât oeng tôdrong kon koâng ñei pôjing ñei ngo la tôdrong tôgum adring tuk bôngot dônuh, ñeân ôn ñap nghia"
"Nhiều giá trị văn hóa, các quy định pháp luật và quy chế, quy tắc ứng xử văn hóa ngày càng thâm nhập vào đời sống đã góp phần quan trọng tạo dựng môi trường sống lành mạnh cho cộng đồng dân cư, cho mỗi gia đình và cá nhân","Lö giaê tri vaên hoa, rim tôdrong phap luaât oeng quy cheâ, quy taêc öng xö vaên hoa naêr kang naêm tômöt tôdrong yaêl arih jôh pôgop tôdrong pôgloh pôm moâi tröông yaêl arih alöng lieâm aên naê ma cham pôlei, aên rim unh hnam oeng kôdih ôkôu"
"Vai trò, vị trí của gia đình và cộng đồng được nâng lên trong xây dựng đời sống văn hóa; tình làng, nghĩa xóm được củng cố, thực hiện nếp sống văn minh trong việc cưới, việc tang và lễ kỷ niệm có tiến bộ ở nhiều nơi","Vai tro, vi tri ñông unh hnam oeng naê ma cham pôlei ñei poâk xuoân lôm tôjung pôm tôdrong yaêl arih vaên hoa; pôm tôdrong yaêl arih vaên minh lôm tôdrong aêng mai, tôdrong bu ataêu oeng maêng ky nieâm ôi tôdrong tôplih oei lö cham pôlei"
"Nhiều giá trị văn hóa dân tộc được bảo tồn, phát huy làm phong phú đời sống văn hóa của nhân dân ở cơ sở; hệ thống thiết chế văn hóa cơ sở tiếp tục duy trì, phát triển, góp phần nâng cao mức hưởng thụ văn hóa của người dân","Lö giaê tri vaên hoa kon koâng ñei jö vei, pôjing pôm alöng tôdrong yaêl arih vaên hoa ñông kon tôring oei cô sô; heâ thoâng thieât cheâ vaên hoa cô sô ling lang ñei duy tri, pôjing, pôgop tôdrong poâk xuoân tôdrong höông thu vaên hoa ñông naê ma"
